{
  "$schema": "./platforms.schema.json",
  "source": "https://agentshortlist.com",
  "sourceRepo": "https://github.com/lucaspowell8020/agentshortlist",
  "verifiedDate": "2026-05-18",
  "verificationCadence": "monthly",
  "verificationMethod": "Hands-on testing across real builder workflows. Verdicts and ratings are editorial. Pros and cons reflect production use, not vendor marketing.",
  "license": "CC-BY-4.0",
  "platforms": [
    {
      "slug": "openclaw",
      "name": "OpenClaw",
      "tagline": "The AI that actually does things",
      "category": "harness",
      "categoryLabel": "Open-source harness",
      "url": "https://openclaw.ai",
      "openSource": true,
      "techLevel": "low-code",
      "pricing": "Free and open-source. You pay API costs for whichever model you use.",
      "rating": 4.5,
      "verdict": "The most mature open-source agent harness. If you want one AI doing things across your tools and devices, start here.",
      "bestFor": "Individuals and small teams who want a self-hosted AI that controls their computer, manages email, and runs tasks — without a monthly SaaS bill.",
      "notFor": "Non-technical operators who don't want to run software on their own machines.",
      "description": "OpenClaw is the flagship personal AI harness — 365,000 GitHub stars makes it one of the most popular AI projects ever built. You install it locally (Mac, Windows, or Linux), connect it to a messaging platform (WhatsApp, Telegram, iMessage — it supports 20+), and you have an AI with hands: it browses the web, reads email, executes scripts, fills forms, and talks to your APIs. The community is the main reason to choose it. 365k stars means 500+ contributors, thousands of community-built skills, and documentation that has been written, corrected, and improved by people who actually use it. Model-agnostic: run it against Claude, GPT-4, or a local model. Recent versions (v4.22 and v4.24) added real-time voice streaming integration via xAI/Deepgram/ElevenLabs, native image generation without API keys, and forked context — letting child sub-agents inherit memory from their parents.",
      "pros": [
        "365k stars — the largest open-source agent community by far",
        "Runs on your own hardware, fully private",
        "20+ messaging platform integrations",
        "Model-agnostic: Claude, GPT, local models all supported",
        "Mature plugin and skills ecosystem",
        "v4.22+ adds real-time voice streaming and native image generation",
        "Forked context lets sub-agents inherit memory from parent agents"
      ],
      "cons": [
        "Single-user architecture by default — not built for team deployment",
        "Requires Node.js setup and comfort with a terminal",
        "You manage your own API costs and uptime"
      ],
      "githubUrl": "https://github.com/openclaw/openclaw",
      "githubStars": "365k",
      "license": "MIT"
    },
    {
      "slug": "hermes",
      "name": "Hermes",
      "tagline": "The agent that grows with you",
      "category": "harness",
      "categoryLabel": "Open-source harness",
      "url": "https://hermes-agent.nousresearch.com",
      "openSource": true,
      "techLevel": "developer",
      "pricing": "Free and open-source. Supports 200+ models via OpenRouter.",
      "rating": 4,
      "verdict": "The most technically sophisticated open-source agent. If you want an AI that gets better at your specific workflows over time, Hermes is the only real option.",
      "bestFor": "Technical operators and developers who want a server-deployed agent that builds institutional memory and improves from experience.",
      "notFor": "Anyone who wants a quick setup. Hermes rewards sustained investment.",
      "description": "Hermes is built by Nous Research, one of the most credible independent AI labs. The defining feature is its learning loop: Hermes creates skills from experience, improves them during use, and builds a deepening model of who you are and how you work. Most agents reset every session. Hermes compounds. It runs on a server (Docker, SSH, Modal, Singularity) rather than your local machine, so it operates 24/7 without your laptop needing to be on. It supports 200+ models via OpenRouter, integrates with Telegram, Discord, Slack, WhatsApp, and Signal, and can run parallel isolated subagents for complex tasks. The Atropos RL integration connects it directly to frontier research methods — it's the only production harness with that lineage.",
      "pros": [
        "Genuine self-improvement loop — skills compound over time",
        "Built by Nous Research (serious AI lab backing)",
        "200+ model support via OpenRouter — no vendor lock-in",
        "Server-deployed — runs 24/7 without your machine being on",
        "Parallel subagent execution for complex workflows"
      ],
      "cons": [
        "Steeper setup than OpenClaw — Python-based server deployment",
        "119k stars vs OpenClaw's 365k — smaller community",
        "The self-improvement story requires consistent use to pay off"
      ],
      "githubUrl": "https://github.com/nousresearch/hermes-agent",
      "githubStars": "119k",
      "license": "MIT",
      "useCases": [
        {
          "title": "Automated Email Management",
          "body": "Connect Hermes to your Gmail account and it becomes a real inbox manager. It classifies incoming messages, labels them automatically, and pushes phone notifications for anything high-priority — a sales inquiry, a form fill, a payment alert. It writes its own Python scripts to poll your email on a schedule, which means it's not burning API credits sitting in a loop waiting for something to happen."
        },
        {
          "title": "Daily Briefings and Calendar Integration",
          "body": "Wire Hermes to your Google Calendar and set a cron job. Every morning it pulls your upcoming events, flags anything you missed, and optionally adds a news summary for your specific niche — without you opening a single app. Same setup works for Friday recaps. You get a briefing in Telegram or Discord. You didn't ask for it. It just arrives."
        },
        {
          "title": "Content and Market Research",
          "body": "Give Hermes a research task — find the top trending AI tools, identify YouTube gaps in a niche — and it works through it autonomously. The part that separates it from other tools: when it finishes, you can tell it to save the workflow as a named skill. Call it 'youtube-video-research' and run it again next week with one command. Exact same process, no re-explaining."
        },
        {
          "title": "Social Media Analytics and Auto-Posting",
          "body": "Hermes can scrape post performance from platforms that make API access difficult by using your browser cookies directly. It reads your metrics — likes, replies, reposts — identifies the formats that are working, and can draft and publish new posts on a schedule. The full loop from 'here's an idea' to 'it's posted' runs without you in it."
        },
        {
          "title": "Personal Health Data Tracking",
          "body": "Link Hermes to your Apple Health data via a custom API and set a morning cron job. It pulls your sleep duration, wake time, and step count, cross-references them with your calendar, and delivers a personalised health report before you've had coffee. Not a dashboard — a report, written in plain language, with observations specific to your week."
        },
        {
          "title": "Building a Second Brain",
          "body": "Hermes stores everything it learns about you — memories, skills, preferences — as standard Markdown files. Connect those files to Obsidian and sync them across devices via SyncThing or a NAS drive, and you have a persistent AI wiki that knows your communication style, your ongoing projects, and your context. It doesn't reset between sessions. It accumulates."
        },
        {
          "title": "Coding Assistance and Software Development",
          "body": "Hermes plans, writes, and reviews code. Ask it to automate a local task with a shell script, debug a GitHub issue, or build a working web app from a description. If you're running Open Web UI, it previews what it builds in the browser automatically. It's not a code editor — it's an agent that happens to write code when the task calls for it."
        },
        {
          "title": "Orchestrating Other AI Agents",
          "body": "Hermes can act as the coordinator for a multi-agent setup. Route simple reasoning and quick tasks through Hermes directly. Dispatch complex research or multi-step workflows to OpenClaw or another runtime. Hermes waits for the result, assembles the output, and returns a single clean answer. You interact with one agent. Multiple are working behind it."
        },
        {
          "title": "Automated Business and Sales Reporting",
          "body": "Set a Monday morning cron job. Hermes pulls your App Store revenue, your top-line sales data, or whatever metric your business runs on, formats it clearly, and sends it to Telegram or Discord. No spreadsheet to open. No dashboard to log into. The number arrives where your team already is."
        },
        {
          "title": "Trip Planning and Lifestyle Reminders",
          "body": "Hermes handles the everyday work that isn't business-critical but still takes time — researching flights and hotels, transcribing voice memos, setting recurring reminders to step away from the screen. You can configure heartbeat messages: Hermes checks in on a schedule, sends a stretch reminder, or drops an unsolicited business improvement suggestion when it notices a pattern. It runs whether you're thinking about it or not."
        }
      ]
    },
    {
      "slug": "paperclip",
      "name": "Paperclip",
      "tagline": "The company, not just the employee",
      "category": "harness",
      "categoryLabel": "Agent orchestration",